{
  "schemaVersion": 1,
  "cycleId": "cyc_01jbq3x8n5r7t9v2w4y6z8a0c1",
  "candidateId": "cand_01jbq3x8n5r7t9v2w4y6z8a0d1",
  "headSha": "0123456789abcdef0123456789abcdef01234567",
  "resultVersion": 1,
  "kind": "approved",
  "post": {
    "commentId": 6384700041,
    "url": "https://github.com/scottlz0310/mcp-resource-subscriber/pull/226#issuecomment-6384700041"
  },
  "postedAt": "2026-10-24T13:00:00Z"
}
